{
  "$schema": "http://json-schema.org/draft-07/schema#",
  "title": "Reviewer Output Schema",
  "description": "Framework-level reviewer agent output schema. Review items with severity, decision, acceptance verification, memory updates.",
  "type": "object",
  "required": ["metadata", "taskId", "decision", "reviewItems", "summary"],
  "properties": {
    "metadata": {
      "type": "object",
      "required": ["reviewerVersion", "generatedAt", "taskId"],
      "properties": {
        "reviewerVersion": { "type": "string" },
        "generatedAt": { "type": "string", "format": "date-time" },
        "taskId": { "type": "string", "pattern": "^TASK-[0-9]{3,}$" }
      }
    },
    "taskId": { "type": "string", "pattern": "^TASK-[0-9]{3,}$" },
    "decision": { "type": "string", "enum": ["approved", "changes-requested", "rejected"] },
    "reviewItems": {
      "type": "array", "minItems": 1,
      "items": {
        "type": "object",
        "required": ["category", "severity", "description", "location", "actionable"],
        "properties": {
          "category": { "type": "string", "enum": ["correctness", "security", "performance", "style", "test-coverage", "architecture-compliance", "acceptance-criteria"] },
          "severity": { "type": "string", "enum": ["P0-blocker", "P1-critical", "P2-major", "P3-minor", "P4-suggestion"] },
          "description": { "type": "string", "minLength": 10 },
          "location": { "type": "string" },
          "actionable": { "type": "boolean" },
          "suggestion": { "type": "string" }
        }
      }
    },
    "acceptanceVerification": {
      "type": "array",
      "items": {
        "type": "object",
        "required": ["criterion", "verified", "notes"],
        "properties": {
          "criterion": { "type": "string" },
          "verified": { "type": "boolean" },
          "notes": { "type": "string" }
        }
      }
    },
    "summary": { "type": "string", "minLength": 20 },
    "memoryUpdates": {
      "type": "array",
      "items": {
        "type": "object",
        "required": ["category", "record"],
        "properties": {
          "category": { "type": "string", "enum": ["bugs", "conventions", "risks"] },
          "record": { "type": "object" }
        }
      }
    }
  }
}