{
  "metadata": {
    "reviewerVersion": "healing-cycle",
    "generatedAt": "2026-06-21T08:44:08.538Z",
    "taskId": "TASK-001"
  },
  "taskId": "TASK-001",
  "decision": "approved",
  "reviewItems": [
    {
      "category": "correctness",
      "severity": "P4-suggestion",
      "description": "Auto-healing fix passes schema and cycle checks.",
      "location": "workflow/self-healing-engine.js",
      "actionable": false,
      "suggestion": "No changes required."
    }
  ],
  "summary": "Auto-healing cycle approved after validation.",
  "acceptanceVerification": [],
  "memoryUpdates": []
}